{
  "bundle_digest": "sha256:1111111111111111111111111111111111111111111111111111111111111111",
  "claim_votes": [
    {
      "controlling_reason": "claim.supported",
      "evidence_digests": [],
      "judge_ordinal": 1,
      "subject_id": "c1",
      "subject_kind": "claim",
      "verdict": "adhered",
      "vote_id": "v1"
    },
    {
      "controlling_reason": "claim.supported",
      "evidence_digests": [],
      "judge_ordinal": 2,
      "subject_id": "c1",
      "subject_kind": "claim",
      "verdict": "adhered",
      "vote_id": "v2"
    }
  ],
  "focused_breach_adjudications": [],
  "manifest_digest": "sha256:0000000000000000000000000000000000000000000000000000000000000000",
  "resolved": [
    {
      "controlling_reason": "claim.supported",
      "subject_id": "c1",
      "subject_kind": "claim",
      "verdict": "adhered"
    }
  ],
  "role_votes": [],
  "run_id": "run-1",
  "schema": "judgment-bundle-v1"
}
